{
  "$schema": "https://json-schema.org/draft/2020-12/schema",
  "$id": "https://schemas.grid.ph/feasibility-studio/v1/executive_summary.schema.json",
  "title": "GRID Executive Summary (one page)",
  "description": "Final output of the Executive Summary DAG. Covers the 11 checklist items from the training guide plus 4 GRID additions (verdict, key figures, key risks, limitations). Must fit one A4 page: the sum of all item texts is capped by 'word_count' <= 600.",
  "type": "object",
  "additionalProperties": false,
  "required": ["meta", "mode", "verdict", "key_figures", "items", "key_risks", "next_steps", "limitations", "word_count", "sources", "claims"],
  "properties": {
    "meta": { "$ref": "common.schema.json#/$defs/Meta" },

    "mode": {
      "description": "derived = compressed from a finished Feasibility Report JSON (preferred). standalone = built from intake plus an existing Market Insight report.",
      "type": "string",
      "enum": ["derived", "standalone"]
    },
    "source_report_id": { "description": "Feasibility Report or Market Insight id this summary was built from.", "type": ["string", "null"] },

    "verdict": { "$ref": "common.schema.json#/$defs/Verdict" },

    "key_figures": {
      "description": "Up to 6 headline figures shown as a KPI strip at the top of the page, e.g. lot area, zonal value, asking price range, capital required, IRR, payback. Financial KPIs stay null with status 'to_be_confirmed' unless the owner supplied cost and funding inputs.",
      "$ref": "common.schema.json#/$defs/KpiStripBlock"
    },

    "items": {
      "type": "object",
      "additionalProperties": false,
      "required": [
        "project_description", "company_developer", "goals_objectives",
        "location_analysis", "market_analysis", "technical_study",
        "socio_economic", "environmental", "financial_projection",
        "findings_recommendation", "conclusion"
      ],
      "properties": {
        "project_description":     { "$ref": "#/$defs/Item", "description": "What the project or property is: site, size, intended use, stage." },
        "company_developer":       { "$ref": "#/$defs/Item", "description": "Who owns or will develop it and their track record. Owner input." },
        "goals_objectives":        { "$ref": "#/$defs/Item", "description": "What the owner wants to achieve, taken from the intended use chosen at intake." },
        "location_analysis":       { "$ref": "#/$defs/Item", "description": "Access, corridor, nearby demand anchors, infrastructure." },
        "market_analysis":         { "$ref": "#/$defs/Item", "description": "Demand, supply, prices (asking vs closed stated), absorption." },
        "technical_study":         { "$ref": "#/$defs/Item", "description": "Zoning class, permitted uses, utilities, site constraints, permits path." },
        "socio_economic":          { "$ref": "#/$defs/Item", "description": "Population, incomes, employment, road and government projects, political or LGU factors." },
        "environmental":           { "$ref": "#/$defs/Item", "description": "Flood, fault, landslide, liquefaction flags; ECC requirement." },
        "financial_projection":    { "$ref": "#/$defs/Item", "description": "Capital required, returns, break-even. Inputs required unless owner supplied costs and funding." },
        "findings_recommendation": { "$ref": "#/$defs/Item", "description": "Ranked uses and the recommendation." },
        "conclusion":              { "$ref": "#/$defs/Item", "description": "The decision and what must be true for it to hold." }
      }
    },

    "key_risks": {
      "type": "array",
      "minItems": 1,
      "maxItems": 3,
      "items": {
        "type": "object",
        "additionalProperties": false,
        "required": ["risk", "severity"],
        "properties": {
          "risk": { "type": "string", "maxLength": 160 },
          "severity": { "type": "string", "enum": ["high", "medium", "low"] },
          "mitigation": { "type": "string", "maxLength": 160 }
        }
      }
    },

    "next_steps": {
      "type": "array",
      "minItems": 1,
      "maxItems": 4,
      "items": { "type": "string", "maxLength": 160 }
    },

    "limitations": {
      "description": "What this summary could not cover and which missing inputs caused it. Always rendered, even when empty, as a one-line 'Scope and limits' footer.",
      "type": "array",
      "items": { "$ref": "common.schema.json#/$defs/Limitation" }
    },

    "word_count": { "type": "integer", "minimum": 1, "maximum": 600 },

    "sources": { "type": "array", "items": { "$ref": "common.schema.json#/$defs/Source" } },
    "claims": { "type": "array", "items": { "$ref": "common.schema.json#/$defs/Claim" } },
    "qa": { "type": "array", "items": { "$ref": "common.schema.json#/$defs/QaCheck" } }
  },

  "$defs": {
    "Item": {
      "type": "object",
      "additionalProperties": false,
      "required": ["text", "coverage", "owner", "claim_ids"],
      "properties": {
        "text": {
          "description": "Two to four sentences. Empty string only when coverage is inputs_required or out_of_scope.",
          "type": "string",
          "maxLength": 520
        },
        "coverage": { "$ref": "common.schema.json#/$defs/Coverage" },
        "owner": { "$ref": "common.schema.json#/$defs/Owner" },
        "claim_ids": { "type": "array", "items": { "$ref": "common.schema.json#/$defs/ClaimId" } },
        "see_section": { "description": "Feasibility Report section id to jump to, when mode is derived.", "type": "string" },
        "limitation_ids": { "type": "array", "items": { "type": "string", "pattern": "^L-[0-9]{2,3}$" } }
      }
    }
  }
}
