{
 "meta": {
  "schema_version": "1.0.0",
  "product": "executive_summary",
  "tier": "desk",
  "report_id": "ES-20261019-C6TAG",
  "title": "Executive Summary: C6 Road commercial lot, Calzada–Tipas, Taguig",
  "subject": {
   "name": "C6 Road commercial lot, Calzada–Tipas",
   "address": "C6 Road (Laguna Lake Highway)",
   "city_municipality": "Taguig",
   "province": "Metro Manila",
   "intended_use": "industrial_warehouse",
   "barangay": "Calzada-Tipas",
   "region": "NCR",
   "lot_area": {
    "value": 14323,
    "range": null,
    "unit": "sqm",
    "as_of": null,
    "status": "to_be_confirmed",
    "source_ids": [
     "S-001"
    ],
    "note": "As entered; confirm against title and survey."
   },
   "intended_use_detail": "Dry warehouse"
  },
  "inputs_provided": {
   "level": "L3_plus_cost_and_funding",
   "items": [
    {
     "key": "location",
     "provided": true
    },
    {
     "key": "lot_area",
     "provided": true
    },
    {
     "key": "intended_use",
     "provided": true
    },
    {
     "key": "owner_developer_profile",
     "provided": true
    },
    {
     "key": "goals_objectives",
     "provided": true
    },
    {
     "key": "title_documents",
     "provided": true
    },
    {
     "key": "tax_declaration",
     "provided": true
    },
    {
     "key": "zoning_certificate",
     "provided": false
    },
    {
     "key": "site_survey",
     "provided": false
    },
    {
     "key": "geotechnical_report",
     "provided": false
    },
    {
     "key": "environmental_permits",
     "provided": false
    },
    {
     "key": "unit_mix_and_pricing",
     "provided": true
    },
    {
     "key": "development_cost",
     "provided": true
    },
    {
     "key": "land_cost",
     "provided": true
    },
    {
     "key": "funding_structure",
     "provided": true
    },
    {
     "key": "operating_assumptions",
     "provided": true
    },
    {
     "key": "timeline",
     "provided": true
    }
   ]
  },
  "prepared_for": "Mock client (fictional): Dalisay Logistics Holdings, Inc.",
  "prepared_by": "GRID Property Ventures · Feasibility Studio",
  "generated_at": "2026-10-19T02:00:00.000Z",
  "as_of": "2026-10-19",
  "locale": "en-PH",
  "currency": "PHP",
  "run": {
   "run_id": "run-FR-20261019-H5SNPM",
   "dag_id": "grid.feasibility_report",
   "dag_version": "0.1.0",
   "nodes": [
    {
     "node_id": "N00_intake",
     "model": "prototype",
     "status": "succeeded"
    },
    {
     "node_id": "N01_input_gate",
     "model": "prototype",
     "status": "succeeded"
    },
    {
     "node_id": "N02_planner",
     "model": "prototype",
     "status": "succeeded"
    },
    {
     "node_id": "N03_doc_extract",
     "model": "not connected (prototype)",
     "status": "succeeded"
    },
    {
     "node_id": "N04_r_location",
     "model": "not connected (prototype)",
     "status": "succeeded"
    },
    {
     "node_id": "N05_r_market",
     "model": "not connected (prototype)",
     "status": "succeeded"
    },
    {
     "node_id": "N06_r_technical",
     "model": "not connected (prototype)",
     "status": "succeeded"
    },
    {
     "node_id": "N07_r_socio",
     "model": "not connected (prototype)",
     "status": "succeeded"
    },
    {
     "node_id": "N08_r_environment",
     "model": "not connected (prototype)",
     "status": "succeeded"
    },
    {
     "node_id": "N09_r_developer",
     "model": "not connected (prototype)",
     "status": "succeeded"
    },
    {
     "node_id": "N10_evidence_merge",
     "model": "prototype",
     "status": "succeeded"
    },
    {
     "node_id": "N11_fact_check",
     "model": "not connected (prototype)",
     "status": "succeeded"
    },
    {
     "node_id": "N12_finance_engine",
     "model": "prototype",
     "status": "succeeded"
    },
    {
     "node_id": "N13_section_writers",
     "model": "prototype",
     "status": "succeeded"
    },
    {
     "node_id": "N14_scoring",
     "model": "prototype",
     "status": "succeeded"
    },
    {
     "node_id": "N15_findings",
     "model": "prototype",
     "status": "succeeded"
    },
    {
     "node_id": "N16_qa_critic",
     "model": "prototype",
     "status": "succeeded"
    },
    {
     "node_id": "N17_exec_summary",
     "model": "prototype",
     "status": "succeeded"
    },
    {
     "node_id": "N18_assembler",
     "model": "prototype",
     "status": "succeeded"
    },
    {
     "node_id": "N19_human_review",
     "model": "prototype",
     "status": "succeeded"
    },
    {
     "node_id": "N20_publish",
     "model": "prototype",
     "status": "succeeded"
    }
   ]
  },
  "review": {
   "status": "approved",
   "reviewer": "GRID research team (mock)",
   "reviewed_at": "2026-10-19T09:00:00+08:00"
  },
  "disclaimer": "MOCK REPORT for demonstration. Market facts are real public listings and sources as of 19 October 2026; the client, its project concept and its financial assumptions are fictional. Not a licensed appraisal, engineering, legal, tax or investment opinion. Asking prices are not closed sales."
 },
 "mode": "standalone",
 "source_report_id": "MI-C6-CALZADA",
 "verdict": {
  "rating": "not_feasible",
  "headline": "Not feasible as a leased warehouse at the ₱42,000/sqm asking price: project IRR about 2.5% vs a 12% target. The use supports about ₱9,900/sqm.",
  "conditions": [
   "Test a higher-value use, or negotiate the land price",
   "Confirm zoning, title and flood exposure"
  ],
  "thesis_breaker": "Paying near the asking price for a warehouse use.",
  "confidence": "medium",
  "confidence_note": "Real listings and published costs as of 19 Oct 2026; client assumptions illustrative."
 },
 "key_figures": {
  "type": "kpi_strip",
  "items": [
   {
    "label": "Asking price",
    "figure": {
     "value": 42000,
     "range": null,
     "unit": "PHP/sqm",
     "as_of": "2026-10-19",
     "status": "checked_public_source",
     "source_ids": [
      "S-001"
     ],
     "basis": "asking"
    }
   },
   {
    "label": "Comparable median",
    "figure": {
     "value": 35000,
     "range": null,
     "unit": "PHP/sqm",
     "as_of": "2026-10-19",
     "status": "checked_public_source",
     "source_ids": [
      "S-002"
     ],
     "basis": "asking"
    }
   },
   {
    "label": "Total project cost",
    "figure": {
     "value": 834766000,
     "range": null,
     "unit": "PHP",
     "as_of": "2026-10-19",
     "status": "computed",
     "source_ids": [
      "S-016"
     ]
    }
   },
   {
    "label": "Project IRR",
    "figure": {
     "value": 2.525519158891164,
     "range": null,
     "unit": "%",
     "as_of": "2026-10-19",
     "status": "computed",
     "source_ids": [
      "S-016"
     ]
    }
   },
   {
    "label": "NPV at 12%",
    "figure": {
     "value": -429592892.2548531,
     "range": null,
     "unit": "PHP",
     "as_of": "2026-10-19",
     "status": "computed",
     "source_ids": [
      "S-016"
     ]
    }
   },
   {
    "label": "Land price that works",
    "figure": {
     "value": 9900,
     "range": null,
     "unit": "PHP/sqm",
     "as_of": "2026-10-19",
     "status": "computed",
     "source_ids": [
      "S-016"
     ]
    }
   }
  ]
 },
 "items": {
  "project_description": {
   "text": "A 14,323 sqm vacant commercial lot with direct C6 Road frontage in Calzada–Tipas, Taguig, asked at ₱42,000/sqm (about ₱601.6M), tested as an 8,000 sqm leased dry warehouse.",
   "coverage": "complete",
   "owner": "grid",
   "claim_ids": []
  },
  "company_developer": {
   "text": "Mock client (fictional): a logistics holding company with three completed projects, buying to build and hold.",
   "coverage": "complete",
   "owner": "grid",
   "claim_ids": []
  },
  "goals_objectives": {
   "text": "Acquire, build in 12 months and lease to 3PL and e-commerce tenants; target 12% project IRR over a 10-year hold.",
   "coverage": "complete",
   "owner": "grid",
   "claim_ids": []
  },
  "location_analysis": {
   "text": "Strong access: C-6 widened to four lanes in 2017, linking Taytay to Bicutan, with the planned C6 Expressway adding upside. Taguig had 1.31M residents at the 2024 census.",
   "coverage": "complete",
   "owner": "grid",
   "claim_ids": []
  },
  "market_analysis": {
   "text": "Twelve nearby lot listings are asked at ₱20,000–70,000/sqm (median ₱35,000); the subject is ~20% above the median. Warehouse asking rents run ₱250–500/sqm/month.",
   "coverage": "complete",
   "owner": "grid",
   "claim_ids": []
  },
  "technical_study": {
   "text": "Zoning, title and site studies are not yet confirmed. Steel warehouses cost ₱14,000–22,000/sqm before slab, fire protection and site works.",
   "coverage": "complete",
   "owner": "grid",
   "claim_ids": []
  },
  "socio_economic": {
   "text": "Land in the C-5 and C-6 belts now competes with residential use; the BSP rate is 5.00% with a hike expected.",
   "coverage": "complete",
   "owner": "grid",
   "claim_ids": []
  },
  "environmental": {
   "text": "Lakeshore lowland with a flood history (Ondoy 2009). An elevation survey and flood check are needed; ₱20M site works is budgeted.",
   "coverage": "complete",
   "owner": "grid",
   "claim_ids": []
  },
  "financial_projection": {
   "text": "Total cost ₱834.8M. Stabilised net income about ₱35.0M a year (4.2% yield). Project IRR 2.5%; NPV −₱429.6M at 12%.",
   "coverage": "complete",
   "owner": "grid",
   "claim_ids": []
  },
  "findings_recommendation": {
   "text": "Land is the problem: the use supports ~₱9,900/sqm, or rents of ~₱1,000/sqm at the asking price. Test a higher-value use or negotiate.",
   "coverage": "complete",
   "owner": "grid",
   "claim_ids": []
  },
  "conclusion": {
   "text": "Not feasible as a warehouse at the asking price. The site's C6 frontage and size merit a test of retail or mixed-use, after zoning and flood checks.",
   "coverage": "complete",
   "owner": "grid",
   "claim_ids": []
  }
 },
 "key_risks": [
  {
   "risk": "Land price far above what warehouse rents support",